{
  "schema_version": "parseatlas.primitive_graph.v1",
  "reference_revision": "fef231d4e4173bd016fb2a3a1eff67087396a203",
  "evidence_class": "SOURCE_OBSERVED",
  "scope": "Frozen CPU source-family inventory supporting bottom-up modular research. Witnessed presence and call sites are not a proof that every branch is compiled or executed. No runtime timings, arithmetic changes or full-engine completeness claim.",
  "sources": [
    {
      "path": "src/cpu/include/secp256k1/detail/arith64.hpp",
      "sha256": "cc95a42137df602eaee3a560993b8c59c091e017364a0345be486ba012de205d"
    },
    {
      "path": "src/cpu/include/secp256k1/field.hpp",
      "sha256": "da944a2803c7ec3f07fd2a3e1ec93581bdc94dc6f3f9db402edc9459b4b1b381"
    },
    {
      "path": "src/cpu/include/secp256k1/field_52.hpp",
      "sha256": "95ca595490b827c6cc1965a7ae2feb1ae72546c3b60dba0562f94f842f998898"
    },
    {
      "path": "src/cpu/include/secp256k1/field_52_impl.hpp",
      "sha256": "2c3f77d7855e9881ebeaf2b7f53de61e683de5201c77d23caaa288df8bf2afb3"
    },
    {
      "path": "src/cpu/include/secp256k1/field_4x64_inline.hpp",
      "sha256": "1d505f236f45e6461d8d8ef7f64ed60b1dd0cb451d3e0659238e66961ad9e168"
    },
    {
      "path": "src/cpu/include/secp256k1/scalar.hpp",
      "sha256": "610844d21051f606d418c2e38f9ec273cd3ab3bcc62b6d8841c1931f546bcc25"
    },
    {
      "path": "src/cpu/include/secp256k1/point.hpp",
      "sha256": "61c35951040476ca8b0b96807dd12af2dc3a8f7b3f3f1f9f83ddfcea9ec4b2ec"
    },
    {
      "path": "src/cpu/src/field.cpp",
      "sha256": "db5792d9bc0b51cfd12927af11fae7160c1a671b8028e0c4d73ef7f3fb6e6812"
    },
    {
      "path": "src/cpu/src/field_52.cpp",
      "sha256": "b797a1c7a1219735424859d912596d5c3f50e1848036865d15d2879adeb8207a"
    },
    {
      "path": "src/cpu/src/scalar.cpp",
      "sha256": "9da20c8fbe95c531b73fd494ff8e7a969d055ae31e8a7b4b588d0885a960050e"
    },
    {
      "path": "src/cpu/src/point.cpp",
      "sha256": "1bbbac53248572ee52df6c1b84cd40529bbf676360dee8fb2df60c245c3726f0"
    },
    {
      "path": "src/cpu/src/pippenger.cpp",
      "sha256": "5b6d2d0c5d04cf763e77d182f765655e639922cb6cf85c8dc5401ae2fc915f38"
    },
    {
      "path": "src/cpu/src/ecdsa.cpp",
      "sha256": "25e445afedc8b77e69015c1da1bf452c88bbbbf5ce3bbfb43a4c302bb80fda07"
    },
    {
      "path": "src/cpu/src/batch_verify.cpp",
      "sha256": "e3e6e25525b5dd9558f1dc2ab5736d5d2658f58d32fc35da4855beae04cd498a"
    },
    {
      "path": "src/cpu/tests/test_comprehensive.cpp",
      "sha256": "757d767788739f80eb75f6eeccc0b7f44ed6b0071d126ea3f0f27be7e2b49a01"
    },
    {
      "path": "experiments/representation_search/README.md",
      "sha256": "28516a064602bf521202a53c4ff2b3707a6418704d8a26751d68c8c5d8a3c220"
    }
  ],
  "witnesses": [
    {
      "id": "word_carry",
      "path": "src/cpu/include/secp256k1/detail/arith64.hpp",
      "symbol": "add64",
      "start_line": 53,
      "end_line": 71,
      "tokens": [
        "unsigned __int128 const sum",
        "sum >> 64",
        "sub64",
        "borrow = borrow1 | borrow2"
      ]
    },
    {
      "id": "word_product",
      "path": "src/cpu/src/field.cpp",
      "symbol": "mul64",
      "start_line": 31,
      "end_line": 72,
      "tokens": [
        "unsigned __int128 const product",
        "product >> 64"
      ]
    },
    {
      "id": "fp_modulus",
      "path": "src/cpu/src/field.cpp",
      "symbol": "PRIME",
      "start_line": 76,
      "end_line": 86,
      "tokens": [
        "0xFFFFFFFEFFFFFC2FULL",
        "MOD_ADJUST"
      ]
    },
    {
      "id": "fp_add",
      "path": "src/cpu/src/field.cpp",
      "symbol": "add_impl",
      "start_line": 423,
      "end_line": 448,
      "tokens": [
        "s[0] = add64(a[0], b[0], c1);",
        "c1 | c2",
        "MOD_ADJUST"
      ]
    },
    {
      "id": "fp_mul_dispatch",
      "path": "src/cpu/src/field.cpp",
      "symbol": "mul_impl",
      "start_line": 1136,
      "end_line": 1178,
      "tokens": [
        "has_bmi2_support() && has_adx_support()",
        "return reduce(mul_wide(a, b));",
        "field_mul_full_asm(a.data(), b.data(), out.data());"
      ]
    },
    {
      "id": "fp_inverse",
      "path": "src/cpu/src/field.cpp",
      "symbol": "FieldElement::inverse",
      "start_line": 3541,
      "end_line": 3554,
      "tokens": [
        "Inverse of zero not defined",
        "return zero();",
        "fe_inverse_safegcd_impl(*this)",
        "field_safegcd30::inverse_impl(*this)"
      ]
    },
    {
      "id": "fp_bytes",
      "path": "src/cpu/src/field.cpp",
      "symbol": "FieldElement::to_bytes",
      "start_line": 2517,
      "end_line": 2526,
      "tokens": [
        "limbs_[3 - i]",
        "limb >> (56 - 8 * j)"
      ]
    },
    {
      "id": "fp_raw_boundary",
      "path": "src/cpu/include/secp256k1/field.hpp",
      "symbol": "from_limbs_raw",
      "start_line": 62,
      "end_line": 70,
      "tokens": [
        "fe.limbs_ = limbs;",
        "return fe;"
      ]
    },
    {
      "id": "fp52_mul",
      "path": "src/cpu/include/secp256k1/field_52_impl.hpp",
      "symbol": "FieldElement52::operator*",
      "start_line": 2438,
      "end_line": 2443,
      "tokens": [
        "fe52_mul_inner(r.n, n, rhs.n);"
      ]
    },
    {
      "id": "fp52_lazy",
      "path": "src/cpu/include/secp256k1/field_52_impl.hpp",
      "symbol": "FieldElement52::operator+",
      "start_line": 2494,
      "end_line": 2527,
      "tokens": [
        "r.n[4] = n[4] + rhs.n[4];",
        "FieldElement52::negate",
        "r.n[0] = m1 * P0 - n[0];"
      ]
    },
    {
      "id": "fp52_weak",
      "path": "src/cpu/include/secp256k1/field_52_impl.hpp",
      "symbol": "fe52_normalize_weak",
      "start_line": 2410,
      "end_line": 2430,
      "tokens": [
        "t0 += x * 0x1000003D1ULL;",
        "t4 += (t3 >> 52);"
      ]
    },
    {
      "id": "fp52_full",
      "path": "src/cpu/include/secp256k1/field_52_impl.hpp",
      "symbol": "fe52_normalize_inline",
      "start_line": 2636,
      "end_line": 2668,
      "tokens": [
        "t0 >= 0xFFFFEFFFFFC2FULL",
        "t4 &= M48;"
      ]
    },
    {
      "id": "fp52_from",
      "path": "src/cpu/include/secp256k1/field_52_impl.hpp",
      "symbol": "FieldElement52::from_fe",
      "start_line": 2744,
      "end_line": 2754,
      "tokens": [
        "const auto& L = fe.limbs();",
        "r.n[4] =  L[3] >> 16;"
      ]
    },
    {
      "id": "fp52_to",
      "path": "src/cpu/include/secp256k1/field_52_impl.hpp",
      "symbol": "FieldElement52::to_fe",
      "start_line": 2758,
      "end_line": 2769,
      "tokens": [
        "fe52_normalize_inline(tmp.n);",
        "return FieldElement::from_limbs_raw(L);"
      ]
    },
    {
      "id": "fp52_inverse_boundary",
      "path": "src/cpu/src/field_52.cpp",
      "symbol": "FieldElement52::inverse",
      "start_line": 111,
      "end_line": 126,
      "tokens": [
        "SECP256K1_HYBRID_4X64_ACTIVE",
        "fe52_normalize_and_pack_4x64(n, a);",
        "field_sqr_full_asm(a, x2);"
      ]
    },
    {
      "id": "fp52_layout",
      "path": "src/cpu/include/secp256k1/field_52.hpp",
      "symbol": "FieldElement52",
      "start_line": 54,
      "end_line": 100,
      "tokens": [
        "std::uint64_t n[5];",
        "void normalize_weak() noexcept;",
        "void normalize() noexcept;"
      ]
    },
    {
      "id": "fp4_inline_kernel",
      "path": "src/cpu/include/secp256k1/field_4x64_inline.hpp",
      "symbol": "void mul",
      "start_line": 22,
      "end_line": 76,
      "tokens": [
        "defined(__ADX__) && defined(__BMI2__)",
        "__restrict__ r",
        "__asm__ __volatile__"
      ]
    },
    {
      "id": "fn_modulus",
      "path": "src/cpu/src/scalar.cpp",
      "symbol": "ORDER",
      "start_line": 19,
      "end_line": 27,
      "tokens": [
        "0xBFD25E8CD0364141ULL",
        "0xBAAEDCE6AF48A03BULL"
      ]
    },
    {
      "id": "fn_add",
      "path": "src/cpu/src/scalar.cpp",
      "symbol": "add_impl",
      "start_line": 83,
      "end_line": 103,
      "tokens": [
        "sum[i] = add64(a[i], b[i], carry);",
        "reduced[i] = sub64(sum[i], ORDER[i], borrow);"
      ]
    },
    {
      "id": "fn_mul",
      "path": "src/cpu/src/scalar.cpp",
      "symbol": "Scalar::operator*",
      "start_line": 342,
      "end_line": 445,
      "tokens": [
        "#ifndef SECP256K1_NO_INT128",
        "0x402DA1732FC9BEBFULL",
        "const unsigned __int128 p",
        "extract_to(l6);"
      ]
    },
    {
      "id": "fn_inverse",
      "path": "src/cpu/src/scalar.cpp",
      "symbol": "Scalar::inverse",
      "start_line": 893,
      "end_line": 897,
      "tokens": [
        "if (is_zero()) return Scalar::zero();",
        "scalar_safegcd::inverse_impl(limbs_)"
      ]
    },
    {
      "id": "fn_bytes",
      "path": "src/cpu/src/scalar.cpp",
      "symbol": "Scalar::to_bytes",
      "start_line": 278,
      "end_line": 289,
      "tokens": [
        "write_bytes(out.data());",
        "store_be64(out32 + 24, limbs_[0]);"
      ]
    },
    {
      "id": "fn_layout",
      "path": "src/cpu/include/secp256k1/scalar.hpp",
      "symbol": "class Scalar",
      "start_line": 14,
      "end_line": 41,
      "tokens": [
        "std::array<std::uint64_t, 4>",
        "parse_bytes_strict_nonzero"
      ]
    },
    {
      "id": "point_layout",
      "path": "src/cpu/include/secp256k1/point.hpp",
      "symbol": "FieldElement52",
      "start_line": 14,
      "end_line": 32,
      "tokens": [
        "SECP256K1_FE52_COMPUTE",
        "SECP256K1_FAST_52BIT"
      ]
    },
    {
      "id": "point_add",
      "path": "src/cpu/src/point.cpp",
      "symbol": "Point::add",
      "start_line": 1869,
      "end_line": 1947,
      "tokens": [
        "dx52.to_fe();",
        "dx.inverse();",
        "FieldElement const dx = other.x_ - x_;",
        "jac52_add(p52, q52);",
        "jacobian_add(p, q);"
      ]